{
  "version": "0.1",
  "surfaceId": "main",
  "root": "layout-1",
  "nodes": [
    {
      "id": "layout-1",
      "type": "Row",
      "children": [
        "calculator-left",
        "calculator-right"
      ],
      "gap": "large",
      "justify": "spaceBetween"
    },
    {
      "id": "calculator-left",
      "type": "Calculator"
    },
    {
      "id": "calculator-right",
      "type": "Calculator"
    }
  ]
}
