{
  "version": "0.1",
  "surfaceId": "main",
  "root": "layout-1",
  "nodes": [
    {
      "id": "layout-1",
      "type": "Column",
      "children": [
        "calculator-main",
        "history-main"
      ]
    },
    {
      "id": "calculator-main",
      "type": "Calculator"
    },
    {
      "id": "history-main",
      "type": "CalculationHistory"
    }
  ]
}
