{
  "version": "0.1",
  "surfaceId": "main",
  "root": "level1",
  "nodes": [
    {"id": "level1", "type": "Column", "children": ["level2"]},
    {"id": "level2", "type": "Row", "children": ["level3"]},
    {"id": "level3", "type": "Column", "children": ["level4"]},
    {"id": "level4", "type": "Row", "children": ["level5"]},
    {"id": "level5", "type": "Column", "children": ["level6"]},
    {"id": "level6", "type": "Row", "children": ["level7"]},
    {"id": "level7", "type": "Column", "children": ["calculator-main"]},
    {"id": "calculator-main", "type": "Calculator"}
  ]
}
