{
  "version": "0.1",
  "surfaceId": "main",
  "root": "root",
  "nodes": [
    {"id": "root", "type": "Column", "children": ["top", "bottom"], "gap": "medium"},
    {"id": "top", "type": "Row", "children": ["calculator-main", "stats-main"], "gap": "medium"},
    {"id": "bottom", "type": "Row", "children": ["history-main", "notes-main"], "gap": "medium"},
    {"id": "calculator-main", "type": "Calculator"},
    {"id": "stats-main", "type": "CalculationStats"},
    {"id": "history-main", "type": "CalculationHistory"},
    {"id": "notes-main", "type": "NotePad"}
  ]
}
