{
  "version": "0.1",
  "surfaceId": "main",
  "root": "layout-1",
  "nodes": [
    {
      "id": "layout-1",
      "type": "Column",
      "children": [
        "layout-2",
        "layout-3"
      ],
      "gap": "medium"
    },
    {
      "id": "layout-2",
      "type": "Row",
      "children": [
        "calculator-main",
        "stats-main"
      ],
      "gap": "medium"
    },
    {
      "id": "calculator-main",
      "type": "Calculator"
    },
    {
      "id": "stats-main",
      "type": "CalculationStats"
    },
    {
      "id": "layout-3",
      "type": "Row",
      "children": [
        "history-main",
        "notes-main"
      ],
      "gap": "medium"
    },
    {
      "id": "history-main",
      "type": "CalculationHistory"
    },
    {
      "id": "notes-main",
      "type": "NotePad"
    }
  ]
}
